enunciados;modelos;datos;incognitas;solución
Un motor de ignición por compresión de seis cilindros, cuatro tiempos, 3.2 L, opera en un ciclo Diesel ideal con una relación de compresión de 19. El aire está a 95 kPa y 67 ºC al inicio del proceso de compresión y la velocidad de rotación del motor es de 1750 rpm. El motor usa diesel ligero con un poder calorífico de 42500 kJ/kg, una relación aire-combustible de 28 y una eficiencia de combustión de 98 por ciento. Usando calores específicos constantes a 850 K, determine a) la temperatura máxima en el ciclo y la relación de cierre de admisión, b) la producción neta de trabajo por ciclo y la eficiencia térmica, c) la presión media efectiva, d) la producción neta de potencia y e) el consumo específico de combustible, en g/kWh, definido como la relación de la masa de combustible consumido al tr;Diesel;rk=19, P1=95 kPa, T1=67 ºC, rev=1750 rpm, podercal=42500 kJ/kg, relairecomb=28, ncomb=98%;T3, rca, wn, nt, pme, pot, cec;cp=1.110 kJ/kg K, cv=0.823 kJ/kg K, R=0.287 kJ/kg K, k=1.349, T2=950.1 K, P2=5044 kPa, vc=0.0001778 m3, v1=0.003288 m3, m=0.003288 kg, mf=0.0001134 kg qe=4.723 kJ, T3=2224 K, rc=2.362,v2=0.0001778 m3, v3=0.0004199 m3, v4=0.003288 m3, P3=5044 kPa
Un motor funciona con base en un ciclo Otto. Las condiciones al inicio de la compresión son 27 ºC y 100 kPa. El calor agregado es 1840 kJ/kg. La relación de compresión es 8. Determinar la temperatura y la presión en cada punto de ciclo, la eficiencia térmica y la presión media ef;Otto;T1=300 K, P1=100 kPa, rk=8, qe=1840 kJ/kg;T2, P2, T3, P3, T4, P4, nt, pme;T2=689.2 K, P2=1837.9 kPa, P3=8676.1 kPa, T4=1416.2 K, p4=472.1 kPa, nt=56.5%, v1=0.864 m3,v2=0.108 m3, qs=801 kJ/kg, wn=1039 kJ/kg, pme=1374.3 kPa
Un motor ideal Diesel tiene una relación de compresión de 20 y usa aire como fluido de trabajo. El estado del aire al principio del proceso de compresión es 95 kPa y 20 ºC. Si la temperatura máxima en el ciclo no ha de exceder 2.200 K, determine: a) la eficiencia térmica, b) la presión efectiva media, Suponga calores específicos constantes para el aire a temperatura a;Diesel;rk=20,P1=95 kPa,T1=20 ºC,T3=2200 ;nt, pme;nt=63.5 %, pme=933 kPa
Una central eléctrica de turbina de gas que opera en un ciclo Brayton ideal tiene una relación de presión de 8. La temperatura del gas es de 300 K en la entrada del compresor y de 1 300 K en la entrada de la turbina. Utilice las suposiciones de aire estándar y determine a) la temperatura del gas a la salida del compresor y de la turbina, b) la relación del trabajo de retroceso y c) la eficiencia té;Joule;rk=8, T1=300 K, T3=1300 K;T2, T4, rwretroceso, nt;h1=300.19 kJ/kg, T2=540 K, h2=544.35 kJ/kg, h3=1395.97 kJ/kg, T4=770 K, h4=789.37 kJ/kg, we=244.16 kJ/kg, ws=606.60 kJ/kg, rbw40.3%,qe=851.62 kJ/kg, wn=42.6%, qs=489.2 kJ/kg, nt=42.6%,ntciclo=44.8%
Una planta de potencia de turbina de gas opera según un ciclo de aire estándar entre los límites de presión de 1 y 6.4 bares. La temperatura del aire de entrada es de 22 C, y la limitación de temperatura en la turbina es de 807 C. Si las eficiencias adiabáticas del compresor y la turbina son 82 y 85%, respectivamente, calcule: a) la producción neta de trabajo, y b) la eficiencia térmica si el ciclo e;Joule;P1=1 bar, P2=6.4 bar, T1=22 ºC, T3=807 ºC, eficadiabcomp=82 %, eficadiabturb=85;wn, nt;h1=295.2 kJ/kg, T2=499 K, h2=502 kJ/kg, we=252.2 kJ/kg, h3=1138 kJ/kg, h4=679 kJ/kg, T4=669 K, ws=-459 kJ/kg, wn=137.95 kJ/kg, nt=0.234
Vamos a considerar un ciclo Diesel en la que el aire a la entrada está a una presión de 1 atm y una temperatura de 17 °C, la razón de compresión es 18 y la de combustión vale 2. El volumen máximo de la cámara es de 1900 cm³. Vamos a determinar los volúmenes, presiones y temperaturas de cada vértice del ciclo, así como su rendimiento y el calor y el trabajo intercambiad;Diesel;P1=1 atm, T1=17 ºC, rk=18, rcomb=2, vmax=1900 cm;v1, v2, v3, v4, P2, P3, P4, T2, T3, T4, nt, qe, qs, wn;Vb=105.6 cm3, T2=921.5 K, Pb=57.2 atm, Pc=57.2 atm, Vc=211.1 cm3, T3=1843 K, Vd=1900 cm3, Vc=1900 cm3, Td=765.3 K, P4=2.64 atm, qe=21.13 kJ, qs=7.79 kJ, w=13.35 kJ, nt=63.2%
